{
  "name": "AWS Connector Service",
  "prefix": "awsconnector",
  "url": "https://docs.aws.amazon.com/service-authorization/latest/reference/list_awsconnectorservice.html",
  "actions": {
    "GetConnectorHealth": {
      "description": "Retrieves all health metrics that were published from the Server Migration Connector.",
      "accessLevel": "Read",
      "permissionOnly": true,
      "resourceTypes": {},
      "conditionKeys": [],
      "dependentActions": [],
      "url": "https://docs.aws.amazon.com/server-migration-service/latest/userguide/prereqs.html#connector-permissions"
    },
    "RegisterConnector": {
      "description": "Registers AWS Connector with AWS Connector Service.",
      "accessLevel": "Write",
      "permissionOnly": true,
      "resourceTypes": {},
      "conditionKeys": [],
      "dependentActions": [],
      "url": "https://docs.aws.amazon.com/server-migration-service/latest/userguide/prereqs.html#connector-permissions"
    },
    "ValidateConnectorId": {
      "description": "Validates Server Migration Connector Id that was registered with AWS Connector Service.",
      "accessLevel": "Read",
      "permissionOnly": true,
      "resourceTypes": {},
      "conditionKeys": [],
      "dependentActions": [],
      "url": "https://docs.aws.amazon.com/server-migration-service/latest/userguide/prereqs.html#connector-permissions"
    }
  },
  "resourceTypes": {},
  "conditionKeys": {}
}