{
  "name": "AWS Application Auto Scaling",
  "prefix": "application-autoscaling",
  "url": "https://docs.aws.amazon.com/service-authorization/latest/reference/list_awsapplicationautoscaling.html",
  "actions": {
    "DeleteScalingPolicy": {
      "description": "Grants permission to delete a scaling policy",
      "accessLevel": "Write",
      "permissionOnly": false,
      "resourceTypes": {},
      "conditionKeys": [],
      "dependentActions": [],
      "url": "https://docs.aws.amazon.com/autoscaling/application/APIReference/API_DeleteScalingPolicy.html"
    },
    "DeleteScheduledAction": {
      "description": "Grants permission to delete a scheduled action",
      "accessLevel": "Write",
      "permissionOnly": false,
      "resourceTypes": {},
      "conditionKeys": [],
      "dependentActions": [],
      "url": "https://docs.aws.amazon.com/autoscaling/application/APIReference/API_DeleteScheduledAction.html"
    },
    "DeregisterScalableTarget": {
      "description": "Grants permission to deregister a scalable target",
      "accessLevel": "Write",
      "permissionOnly": false,
      "resourceTypes": {},
      "conditionKeys": [],
      "dependentActions": [],
      "url": "https://docs.aws.amazon.com/autoscaling/application/APIReference/API_DeregisterScalableTarget.html"
    },
    "DescribeScalableTargets": {
      "description": "Grants permission to describe one or more scalable targets in the specified namespace",
      "accessLevel": "Read",
      "permissionOnly": false,
      "resourceTypes": {},
      "conditionKeys": [],
      "dependentActions": [],
      "url": "https://docs.aws.amazon.com/autoscaling/application/APIReference/API_DescribeScalableTargets.html"
    },
    "DescribeScalingActivities": {
      "description": "Grants permission to describe a set of scaling activities or all scaling activities in the specified namespace",
      "accessLevel": "Read",
      "permissionOnly": false,
      "resourceTypes": {},
      "conditionKeys": [],
      "dependentActions": [],
      "url": "https://docs.aws.amazon.com/autoscaling/application/APIReference/API_DescribeScalingActivities.html"
    },
    "DescribeScalingPolicies": {
      "description": "Grants permission to describe a set of scaling policies or all scaling policies in the specified namespace",
      "accessLevel": "Read",
      "permissionOnly": false,
      "resourceTypes": {},
      "conditionKeys": [],
      "dependentActions": [],
      "url": "https://docs.aws.amazon.com/autoscaling/application/APIReference/API_DescribeScalingPolicies.html"
    },
    "DescribeScheduledActions": {
      "description": "Grants permission to describe a set of scheduled actions or all scheduled actions in the specified namespace",
      "accessLevel": "Read",
      "permissionOnly": false,
      "resourceTypes": {},
      "conditionKeys": [],
      "dependentActions": [],
      "url": "https://docs.aws.amazon.com/autoscaling/application/APIReference/API_DescribeScheduledActions.html"
    },
    "PutScalingPolicy": {
      "description": "Grants permission to create and update a scaling policy for a scalable target",
      "accessLevel": "Write",
      "permissionOnly": false,
      "resourceTypes": {},
      "conditionKeys": [],
      "dependentActions": [],
      "url": "https://docs.aws.amazon.com/autoscaling/application/APIReference/API_PutScalingPolicy.html"
    },
    "PutScheduledAction": {
      "description": "Grants permission to create and update a scheduled action for a scalable target",
      "accessLevel": "Write",
      "permissionOnly": false,
      "resourceTypes": {},
      "conditionKeys": [],
      "dependentActions": [],
      "url": "https://docs.aws.amazon.com/autoscaling/application/APIReference/API_PutScheduledAction.html"
    },
    "RegisterScalableTarget": {
      "description": "Grants permission to register AWS or custom resources as scalable targets with Application Auto Scaling and to update configuration parameters used to manage a scalable target",
      "accessLevel": "Write",
      "permissionOnly": false,
      "resourceTypes": {},
      "conditionKeys": [],
      "dependentActions": [],
      "url": "https://docs.aws.amazon.com/autoscaling/application/APIReference/API_RegisterScalableTarget.html"
    }
  },
  "resourceTypes": {},
  "conditionKeys": {}
}