{
  "name": "Amazon Kinesis Firehose",
  "prefix": "firehose",
  "url": "https://docs.aws.amazon.com/service-authorization/latest/reference/list_amazonkinesisfirehose.html",
  "actions": {
    "CreateDeliveryStream": {
      "description": "Grants permission to create a delivery stream",
      "accessLevel": "Write",
      "permissionOnly": false,
      "resourceTypes": {
        "deliverystream": {
          "required": true,
          "conditionKeys": []
        }
      },
      "conditionKeys": [
        "aws:RequestTag/${TagKey}",
        "aws:TagKeys"
      ],
      "dependentActions": [],
      "url": "https://docs.aws.amazon.com/firehose/latest/APIReference/API_CreateDeliveryStream.html"
    },
    "DeleteDeliveryStream": {
      "description": "Grants permission to delete a delivery stream and its data",
      "accessLevel": "Write",
      "permissionOnly": false,
      "resourceTypes": {
        "deliverystream": {
          "required": true,
          "conditionKeys": []
        }
      },
      "conditionKeys": [],
      "dependentActions": [],
      "url": "https://docs.aws.amazon.com/firehose/latest/APIReference/API_DeleteDeliveryStream.html"
    },
    "DescribeDeliveryStream": {
      "description": "Grants permission to describe the specified delivery stream and gets the status",
      "accessLevel": "Read",
      "permissionOnly": false,
      "resourceTypes": {
        "deliverystream": {
          "required": true,
          "conditionKeys": []
        }
      },
      "conditionKeys": [],
      "dependentActions": [],
      "url": "https://docs.aws.amazon.com/firehose/latest/APIReference/API_DescribeDeliveryStream.html"
    },
    "ListDeliveryStreams": {
      "description": "Grants permission to list your delivery streams",
      "accessLevel": "List",
      "permissionOnly": false,
      "resourceTypes": {},
      "conditionKeys": [],
      "dependentActions": [],
      "url": "https://docs.aws.amazon.com/firehose/latest/APIReference/API_ListDeliveryStreams.html"
    },
    "ListTagsForDeliveryStream": {
      "description": "Grants permission to list the tags for the specified delivery stream",
      "accessLevel": "List",
      "permissionOnly": false,
      "resourceTypes": {
        "deliverystream": {
          "required": true,
          "conditionKeys": []
        }
      },
      "conditionKeys": [],
      "dependentActions": [],
      "url": "https://docs.aws.amazon.com/firehose/latest/APIReference/API_ListTagsForDeliveryStream.html"
    },
    "PutRecord": {
      "description": "Grants permission to write a single data record into an Amazon Kinesis Firehose delivery stream",
      "accessLevel": "Write",
      "permissionOnly": false,
      "resourceTypes": {
        "deliverystream": {
          "required": true,
          "conditionKeys": []
        }
      },
      "conditionKeys": [],
      "dependentActions": [],
      "url": "https://docs.aws.amazon.com/firehose/latest/APIReference/API_PutRecord.html"
    },
    "PutRecordBatch": {
      "description": "Grants permission to write multiple data records into a delivery stream in a single call, which can achieve higher throughput per producer than when writing single records",
      "accessLevel": "Write",
      "permissionOnly": false,
      "resourceTypes": {
        "deliverystream": {
          "required": true,
          "conditionKeys": []
        }
      },
      "conditionKeys": [],
      "dependentActions": [],
      "url": "https://docs.aws.amazon.com/firehose/latest/APIReference/API_PutRecordBatch.html"
    },
    "StartDeliveryStreamEncryption": {
      "description": "Grants permission to enable server-side encryption (SSE) for the delivery stream",
      "accessLevel": "Write",
      "permissionOnly": false,
      "resourceTypes": {
        "deliverystream": {
          "required": true,
          "conditionKeys": []
        }
      },
      "conditionKeys": [],
      "dependentActions": [],
      "url": "https://docs.aws.amazon.com/firehose/latest/APIReference/API_StartDeliveryStreamEncryption.html"
    },
    "StopDeliveryStreamEncryption": {
      "description": "Grants permission to disable the specified destination of the specified delivery stream",
      "accessLevel": "Write",
      "permissionOnly": false,
      "resourceTypes": {
        "deliverystream": {
          "required": true,
          "conditionKeys": []
        }
      },
      "conditionKeys": [],
      "dependentActions": [],
      "url": "https://docs.aws.amazon.com/firehose/latest/APIReference/API_StopDeliveryStreamEncryption.html"
    },
    "TagDeliveryStream": {
      "description": "Grants permission to add or update tags for the specified delivery stream",
      "accessLevel": "Tagging",
      "permissionOnly": false,
      "resourceTypes": {
        "deliverystream": {
          "required": true,
          "conditionKeys": []
        }
      },
      "conditionKeys": [
        "aws:RequestTag/${TagKey}",
        "aws:TagKeys"
      ],
      "dependentActions": [],
      "url": "https://docs.aws.amazon.com/firehose/latest/APIReference/API_TagDeliveryStream.html"
    },
    "UntagDeliveryStream": {
      "description": "Grants permission to remove tags from the specified delivery stream",
      "accessLevel": "Tagging",
      "permissionOnly": false,
      "resourceTypes": {
        "deliverystream": {
          "required": true,
          "conditionKeys": []
        }
      },
      "conditionKeys": [
        "aws:TagKeys"
      ],
      "dependentActions": [],
      "url": "https://docs.aws.amazon.com/firehose/latest/APIReference/API_UntagDeliveryStream.html"
    },
    "UpdateDestination": {
      "description": "Grants permission to update the specified destination of the specified delivery stream",
      "accessLevel": "Write",
      "permissionOnly": false,
      "resourceTypes": {
        "deliverystream": {
          "required": true,
          "conditionKeys": []
        }
      },
      "conditionKeys": [],
      "dependentActions": [],
      "url": "https://docs.aws.amazon.com/firehose/latest/APIReference/API_UpdateDestination.html"
    }
  },
  "resourceTypes": {
    "deliverystream": {
      "arn": "arn:${Partition}:firehose:${Region}:${Account}:deliverystream/${DeliveryStreamName}",
      "conditionKeys": [
        "aws:ResourceTag/${TagKey}"
      ],
      "url": "https://docs.aws.amazon.com/firehose/latest/dev/basic-create.html"
    }
  },
  "conditionKeys": {
    "aws:RequestTag/${TagKey}": {
      "description": "Filters actions based on the tags that are passed in the request",
      "type": "String",
      "url": "https://docs.aws.amazon.com/IAM/latest/UserGuide/reference_policies_condition-keys.html#condition-keys-requesttag"
    },
    "aws:ResourceTag/${TagKey}": {
      "description": "Filters actions based on the tags associated with the resource",
      "type": "String",
      "url": "https://docs.aws.amazon.com/IAM/latest/UserGuide/reference_policies_condition-keys.html#condition-keys-resourcetag"
    },
    "aws:TagKeys": {
      "description": "Filters actions based on the tag keys that are passed in the request",
      "type": "ArrayOfString",
      "url": "https://docs.aws.amazon.com/IAM/latest/UserGuide/reference_policies_condition-keys.html#condition-keys-tagkeys"
    }
  }
}