{
  "name": "AWS Savings Plans",
  "prefix": "savingsplans",
  "url": "https://docs.aws.amazon.com/service-authorization/latest/reference/list_awssavingsplans.html",
  "actions": {
    "CreateSavingsPlan": {
      "description": "Grants permission to create a savings plan",
      "accessLevel": "Write",
      "permissionOnly": false,
      "resourceTypes": {},
      "conditionKeys": [
        "aws:RequestTag/${TagKey}",
        "aws:TagKeys"
      ],
      "dependentActions": [],
      "url": "https://docs.aws.amazon.com/savingsplans/latest/APIReference/API_CreateSavingsPlan.html"
    },
    "DeleteQueuedSavingsPlan": {
      "description": "Grants permission to delete the queued savings plan associated with customers account",
      "accessLevel": "Write",
      "permissionOnly": false,
      "resourceTypes": {
        "savingsplan": {
          "required": true,
          "conditionKeys": []
        }
      },
      "conditionKeys": [
        "aws:ResourceTag/${TagKey}"
      ],
      "dependentActions": [],
      "url": "https://docs.aws.amazon.com/savingsplans/latest/APIReference/API_DeleteQueuedSavingsPlan.html"
    },
    "DescribeSavingsPlanRates": {
      "description": "Grants permission to describe the rates associated with customers savings plan",
      "accessLevel": "Read",
      "permissionOnly": false,
      "resourceTypes": {
        "savingsplan": {
          "required": true,
          "conditionKeys": []
        }
      },
      "conditionKeys": [
        "aws:ResourceTag/${TagKey}"
      ],
      "dependentActions": [],
      "url": "https://docs.aws.amazon.com/savingsplans/latest/APIReference/API_DescribeSavingsPlanRates.html"
    },
    "DescribeSavingsPlans": {
      "description": "Grants permission to describe the savings plans associated with customers account",
      "accessLevel": "Read",
      "permissionOnly": false,
      "resourceTypes": {
        "savingsplan": {
          "required": true,
          "conditionKeys": []
        }
      },
      "conditionKeys": [
        "aws:ResourceTag/${TagKey}"
      ],
      "dependentActions": [],
      "url": "https://docs.aws.amazon.com/savingsplans/latest/APIReference/API_DescribeSavingsPlans.html"
    },
    "DescribeSavingsPlansOfferingRates": {
      "description": "Grants permission to describe the rates assciated with savings plans offerings",
      "accessLevel": "Read",
      "permissionOnly": false,
      "resourceTypes": {},
      "conditionKeys": [],
      "dependentActions": [],
      "url": "https://docs.aws.amazon.com/savingsplans/latest/APIReference/API_DescribeSavingsPlansOfferingRates.html"
    },
    "DescribeSavingsPlansOfferings": {
      "description": "Grants permission to describe the savings plans offerings that customer is eligible to purchase",
      "accessLevel": "Read",
      "permissionOnly": false,
      "resourceTypes": {},
      "conditionKeys": [],
      "dependentActions": [],
      "url": "https://docs.aws.amazon.com/savingsplans/latest/APIReference/API_DescribeSavingsPlansOfferings.html"
    },
    "ListTagsForResource": {
      "description": "Grants permission to list tags for a savings plan",
      "accessLevel": "List",
      "permissionOnly": false,
      "resourceTypes": {
        "savingsplan": {
          "required": true,
          "conditionKeys": []
        }
      },
      "conditionKeys": [],
      "dependentActions": [],
      "url": "https://docs.aws.amazon.com/savingsplans/latest/APIReference/API_ListTagsForResource.html"
    },
    "TagResource": {
      "description": "Grants permission to tag a savings plan",
      "accessLevel": "Tagging",
      "permissionOnly": false,
      "resourceTypes": {
        "savingsplan": {
          "required": true,
          "conditionKeys": []
        }
      },
      "conditionKeys": [
        "aws:RequestTag/${TagKey}",
        "aws:TagKeys"
      ],
      "dependentActions": [],
      "url": "https://docs.aws.amazon.com/savingsplans/latest/APIReference/API_TagResource.html"
    },
    "UntagResource": {
      "description": "Grants permission to untag a savings plan",
      "accessLevel": "Tagging",
      "permissionOnly": false,
      "resourceTypes": {
        "savingsplan": {
          "required": true,
          "conditionKeys": []
        }
      },
      "conditionKeys": [
        "aws:TagKeys"
      ],
      "dependentActions": [],
      "url": "https://docs.aws.amazon.com/savingsplans/latest/APIReference/API_UntagResource.html"
    }
  },
  "resourceTypes": {
    "savingsplan": {
      "arn": "arn:${Partition}:savingsplans::${Account}:savingsplan/${ResourceId}",
      "conditionKeys": [
        "aws:ResourceTag/${TagKey}"
      ],
      "url": "https://docs.aws.amazon.com/savingsplans/latest/userguide/API_SavingsPlan.html"
    }
  },
  "conditionKeys": {
    "aws:RequestTag/${TagKey}": {
      "description": "Filters actions based on the allowed set of values for each of the tags",
      "type": "String",
      "url": "https://docs.aws.amazon.com/IAM/latest/UserGuide/reference_policies_condition-keys.html#condition-keys-requesttag"
    },
    "aws:ResourceTag/${TagKey}": {
      "description": "Filters actions based on tag-value assoicated with the resource",
      "type": "String",
      "url": "https://docs.aws.amazon.com/IAM/latest/UserGuide/reference_policies_condition-keys.html#condition-keys-resourcetag"
    },
    "aws:TagKeys": {
      "description": "Filters actions based on the presence of mandatory tags in the request",
      "type": "String",
      "url": "https://docs.aws.amazon.com/IAM/latest/UserGuide/reference_policies_condition-keys.html#condition-keys-tagkeys"
    }
  }
}