{
  "name": "Amazon RHEL Knowledgebase Portal",
  "prefix": "rhelkb",
  "url": "https://docs.aws.amazon.com/service-authorization/latest/reference/list_amazonrhelknowledgebaseportal.html",
  "actions": {
    "GetRhelURL": {
      "description": "Grants permission to access the Red Hat Knowledgebase portal",
      "accessLevel": "Read",
      "permissionOnly": false,
      "resourceTypes": {},
      "conditionKeys": [],
      "dependentActions": [],
      "url": "https://docs.aws.amazon.com/systems-manager/latest/userguide/fleet-rhel.html"
    }
  },
  "resourceTypes": {},
  "conditionKeys": {}
}