{
  "name": "Amazon Elastic Transcoder",
  "prefix": "elastictranscoder",
  "url": "https://docs.aws.amazon.com/service-authorization/latest/reference/list_amazonelastictranscoder.html",
  "actions": {
    "CancelJob": {
      "description": "Cancel a job that Elastic Transcoder has not begun to process",
      "accessLevel": "Write",
      "permissionOnly": false,
      "resourceTypes": {
        "job": {
          "required": true,
          "conditionKeys": []
        }
      },
      "conditionKeys": [],
      "dependentActions": [],
      "url": "https://docs.aws.amazon.com/elastictranscoder/latest/developerguide/cancel-job.html"
    },
    "CreateJob": {
      "description": "Create a job",
      "accessLevel": "Write",
      "permissionOnly": false,
      "resourceTypes": {
        "pipeline": {
          "required": true,
          "conditionKeys": []
        },
        "preset": {
          "required": true,
          "conditionKeys": []
        }
      },
      "conditionKeys": [],
      "dependentActions": [],
      "url": "https://docs.aws.amazon.com/elastictranscoder/latest/developerguide/create-job.html"
    },
    "CreatePipeline": {
      "description": "Create a pipeline",
      "accessLevel": "Write",
      "permissionOnly": false,
      "resourceTypes": {},
      "conditionKeys": [],
      "dependentActions": [],
      "url": "https://docs.aws.amazon.com/elastictranscoder/latest/developerguide/create-pipeline.html"
    },
    "CreatePreset": {
      "description": "Create a preset",
      "accessLevel": "Write",
      "permissionOnly": false,
      "resourceTypes": {},
      "conditionKeys": [],
      "dependentActions": [],
      "url": "https://docs.aws.amazon.com/elastictranscoder/latest/developerguide/create-preset.html"
    },
    "DeletePipeline": {
      "description": "Delete a pipeline",
      "accessLevel": "Write",
      "permissionOnly": false,
      "resourceTypes": {
        "pipeline": {
          "required": true,
          "conditionKeys": []
        }
      },
      "conditionKeys": [],
      "dependentActions": [],
      "url": "https://docs.aws.amazon.com/elastictranscoder/latest/developerguide/delete-pipeline.html"
    },
    "DeletePreset": {
      "description": "Delete a preset",
      "accessLevel": "Write",
      "permissionOnly": false,
      "resourceTypes": {
        "preset": {
          "required": true,
          "conditionKeys": []
        }
      },
      "conditionKeys": [],
      "dependentActions": [],
      "url": "https://docs.aws.amazon.com/elastictranscoder/latest/developerguide/delete-preset.html"
    },
    "ListJobsByPipeline": {
      "description": "Get a list of the jobs that you assigned to a pipeline",
      "accessLevel": "List",
      "permissionOnly": false,
      "resourceTypes": {
        "pipeline": {
          "required": true,
          "conditionKeys": []
        }
      },
      "conditionKeys": [],
      "dependentActions": [],
      "url": "https://docs.aws.amazon.com/elastictranscoder/latest/developerguide/list-jobs-by-pipeline.html"
    },
    "ListJobsByStatus": {
      "description": "Get information about all of the jobs associated with the current AWS account that have a specified status",
      "accessLevel": "List",
      "permissionOnly": false,
      "resourceTypes": {},
      "conditionKeys": [],
      "dependentActions": [],
      "url": "https://docs.aws.amazon.com/elastictranscoder/latest/developerguide/list-jobs-by-status.html"
    },
    "ListPipelines": {
      "description": "Get a list of the pipelines associated with the current AWS account",
      "accessLevel": "List",
      "permissionOnly": false,
      "resourceTypes": {},
      "conditionKeys": [],
      "dependentActions": [],
      "url": "https://docs.aws.amazon.com/elastictranscoder/latest/developerguide/list-pipelines.html"
    },
    "ListPresets": {
      "description": "Get a list of all presets associated with the current AWS account",
      "accessLevel": "List",
      "permissionOnly": false,
      "resourceTypes": {},
      "conditionKeys": [],
      "dependentActions": [],
      "url": "https://docs.aws.amazon.com/elastictranscoder/latest/developerguide/list-presets.html"
    },
    "ReadJob": {
      "description": "Get detailed information about a job",
      "accessLevel": "Read",
      "permissionOnly": false,
      "resourceTypes": {
        "job": {
          "required": true,
          "conditionKeys": []
        }
      },
      "conditionKeys": [],
      "dependentActions": [],
      "url": "https://docs.aws.amazon.com/elastictranscoder/latest/developerguide/get-job.html"
    },
    "ReadPipeline": {
      "description": "Get detailed information about a pipeline",
      "accessLevel": "Read",
      "permissionOnly": false,
      "resourceTypes": {
        "pipeline": {
          "required": true,
          "conditionKeys": []
        }
      },
      "conditionKeys": [],
      "dependentActions": [],
      "url": "https://docs.aws.amazon.com/elastictranscoder/latest/developerguide/get-pipeline.html"
    },
    "ReadPreset": {
      "description": "Get detailed information about a preset",
      "accessLevel": "Read",
      "permissionOnly": false,
      "resourceTypes": {
        "preset": {
          "required": true,
          "conditionKeys": []
        }
      },
      "conditionKeys": [],
      "dependentActions": [],
      "url": "https://docs.aws.amazon.com/elastictranscoder/latest/developerguide/get-preset.html"
    },
    "TestRole": {
      "description": "Test the settings for a pipeline to ensure that Elastic Transcoder can create and process jobs",
      "accessLevel": "Write",
      "permissionOnly": false,
      "resourceTypes": {},
      "conditionKeys": [],
      "dependentActions": [],
      "url": "https://docs.aws.amazon.com/elastictranscoder/latest/developerguide/test-pipeline-role.html"
    },
    "UpdatePipeline": {
      "description": "Update settings for a pipeline",
      "accessLevel": "Write",
      "permissionOnly": false,
      "resourceTypes": {
        "pipeline": {
          "required": true,
          "conditionKeys": []
        }
      },
      "conditionKeys": [],
      "dependentActions": [],
      "url": "https://docs.aws.amazon.com/elastictranscoder/latest/developerguide/update-pipeline.html"
    },
    "UpdatePipelineNotifications": {
      "description": "Update only Amazon Simple Notification Service (Amazon SNS) notifications for a pipeline",
      "accessLevel": "Write",
      "permissionOnly": false,
      "resourceTypes": {
        "pipeline": {
          "required": true,
          "conditionKeys": []
        }
      },
      "conditionKeys": [],
      "dependentActions": [],
      "url": "https://docs.aws.amazon.com/elastictranscoder/latest/developerguide/update-pipeline-notifications.html"
    },
    "UpdatePipelineStatus": {
      "description": "Pause or reactivate a pipeline, so the pipeline stops or restarts processing jobs, update the status for the pipeline",
      "accessLevel": "Write",
      "permissionOnly": false,
      "resourceTypes": {
        "pipeline": {
          "required": true,
          "conditionKeys": []
        }
      },
      "conditionKeys": [],
      "dependentActions": [],
      "url": "https://docs.aws.amazon.com/elastictranscoder/latest/developerguide/update-pipeline-status.html"
    }
  },
  "resourceTypes": {
    "job": {
      "arn": "arn:${Partition}:elastictranscoder:${Region}:${Account}:job/${JobId}",
      "conditionKeys": [],
      "url": "https://docs.aws.amazon.com/elastictranscoder/latest/developerguide/operations-jobs.html"
    },
    "pipeline": {
      "arn": "arn:${Partition}:elastictranscoder:${Region}:${Account}:pipeline/${PipelineId}",
      "conditionKeys": [],
      "url": "https://docs.aws.amazon.com/elastictranscoder/latest/developerguide/operations-pipelines.html"
    },
    "preset": {
      "arn": "arn:${Partition}:elastictranscoder:${Region}:${Account}:preset/${PresetId}",
      "conditionKeys": [],
      "url": "https://docs.aws.amazon.com/elastictranscoder/latest/developerguide/operations-presets.html"
    }
  },
  "conditionKeys": {}
}